{
  "asset_id": "azure-sakura-kimono-0326010047",
  "asset_name": "Azure Sakura Kimono",
  "asset_type": "avatar_clothing",
  "category": "clothing_foundation",
  "source": "mesh_ai",
  "source_path": "Meshy_AI_Azure_Sakura_Kimono_0326010047_texture_fbx/Meshy_AI_Azure_Sakura_Kimono_0326010047_texture.fbx",
  "quality_estimate": "8/10",
  "status": "validated",
  "profile_id": "unity_avatar_clothing_v1",
  "target_runtime": "unity",
  "target_unity_path": "Assets/AvatarSystem/AvatarProduction/Wardrobe/Foundations/AzureSakuraKimono",
  "slot": "dress",
  "room_focus_preset": "wardrobe",
  "toolchain_steps": [
    {
      "step_id": "asset_audit",
      "stage": "raw",
      "step_type": "blender_script",
      "description": "Audit the raw clothing mesh from Mesh AI.",
      "outputs": {
        "report_path": "tools/reports/azure_kimono_asset_audit.json"
      },
      "notes": [],
      "script_path": "tools/blender_asset_audit.py",
      "script_absolute_path": "D:\\antigaravity_code\\app_tro_ly\\tools\\blender_asset_audit.py",
      "command_spec": {
        "runner": "blender_cli",
        "executable_hint": "blender",
        "argv": [
          "blender",
          "--background",
          "--python",
          "D:\\antigaravity_code\\app_tro_ly\\tools\\blender_asset_audit.py",
          "--",
          "--input",
          "Meshy_AI_Azure_Sakura_Kimono_0326010047_texture_fbx/Meshy_AI_Azure_Sakura_Kimono_0326010047_texture.fbx",
          "--report",
          "tools/reports/azure_kimono_asset_audit.json"
        ]
      },
      "args": {
        "input": "Meshy_AI_Azure_Sakura_Kimono_0326010047_texture_fbx/Meshy_AI_Azure_Sakura_Kimono_0326010047_texture.fbx",
        "report": "tools/reports/azure_kimono_asset_audit.json"
      }
    },
    {
      "step_id": "dress_fit",
      "stage": "cleaned",
      "step_type": "blender_script",
      "description": "Run the current clothing fit wrapper against the base avatar scene.",
      "outputs": {
        "cleaned_source_path": "bleder/CHR_Dress_AzureSakura_v001_polishfit.blend",
        "report_path": "tools/reports/azure_sakura_dress_polishfit_report.json"
      },
      "notes": [],
      "script_path": "tools/blender_fit_dress_scene.py",
      "script_absolute_path": "D:\\antigaravity_code\\app_tro_ly\\tools\\blender_fit_dress_scene.py",
      "command_spec": {
        "runner": "blender_cli",
        "executable_hint": "blender",
        "argv": [
          "blender",
          "--background",
          "--python",
          "D:\\antigaravity_code\\app_tro_ly\\tools\\blender_fit_dress_scene.py",
          "--",
          "--base-blend",
          "bleder/CHR_Avatar_Base_v001_split15_facial.blend",
          "--source-body-blend",
          "bleder/CHR_Avatar_Base_v001_rigclean.blend",
          "--dress-fbx",
          "Meshy_AI_Azure_Sakura_Kimono_0326010047_texture_fbx/Meshy_AI_Azure_Sakura_Kimono_0326010047_texture.fbx",
          "--output-blend",
          "bleder/CHR_Dress_AzureSakura_v001_polishfit.blend",
          "--report",
          "tools/reports/azure_sakura_dress_polishfit_report.json",
          "--dress-name",
          "CHR_Dress_AzureSakuraKimono_v1"
        ]
      },
      "args": {
        "base-blend": "bleder/CHR_Avatar_Base_v001_split15_facial.blend",
        "source-body-blend": "bleder/CHR_Avatar_Base_v001_rigclean.blend",
        "dress-fbx": "Meshy_AI_Azure_Sakura_Kimono_0326010047_texture_fbx/Meshy_AI_Azure_Sakura_Kimono_0326010047_texture.fbx",
        "output-blend": "bleder/CHR_Dress_AzureSakura_v001_polishfit.blend",
        "report": "tools/reports/azure_sakura_dress_polishfit_report.json",
        "dress-name": "CHR_Dress_AzureSakuraKimono_v1"
      }
    },
    {
      "step_id": "scene_state_report",
      "stage": "validated",
      "step_type": "blender_script",
      "description": "Record scene visibility and review state for the cleaned clothing blend.",
      "outputs": {
        "report_path": "tools/reports/azure_sakura_dress_polishfit_scene_state.json"
      },
      "notes": [],
      "script_path": "tools/blender_scene_state_report.py",
      "script_absolute_path": "D:\\antigaravity_code\\app_tro_ly\\tools\\blender_scene_state_report.py",
      "command_spec": {
        "runner": "blender_cli",
        "executable_hint": "blender",
        "argv": [
          "blender",
          "--background",
          "--python",
          "D:\\antigaravity_code\\app_tro_ly\\tools\\blender_scene_state_report.py",
          "--",
          "--input",
          "bleder/CHR_Dress_AzureSakura_v001_polishfit.blend",
          "--report",
          "tools/reports/azure_sakura_dress_polishfit_scene_state.json"
        ]
      },
      "args": {
        "input": "bleder/CHR_Dress_AzureSakura_v001_polishfit.blend",
        "report": "tools/reports/azure_sakura_dress_polishfit_scene_state.json"
      }
    },
    {
      "step_id": "verify_fit",
      "stage": "validated",
      "step_type": "blender_script",
      "description": "Verify that the fitted clothing deforms with the current avatar rig.",
      "outputs": {
        "report_path": "tools/reports/azure_sakura_dress_polishfit_verify_report.json"
      },
      "notes": [],
      "script_path": "tools/blender_verify_dress_scene.py",
      "script_absolute_path": "D:\\antigaravity_code\\app_tro_ly\\tools\\blender_verify_dress_scene.py",
      "command_spec": {
        "runner": "blender_cli",
        "executable_hint": "blender",
        "argv": [
          "blender",
          "--background",
          "--python",
          "D:\\antigaravity_code\\app_tro_ly\\tools\\blender_verify_dress_scene.py",
          "--",
          "--input",
          "bleder/CHR_Dress_AzureSakura_v001_polishfit.blend",
          "--dress-name",
          "CHR_Dress_AzureSakuraKimono_v1",
          "--report",
          "tools/reports/azure_sakura_dress_polishfit_verify_report.json"
        ]
      },
      "args": {
        "input": "bleder/CHR_Dress_AzureSakura_v001_polishfit.blend",
        "dress-name": "CHR_Dress_AzureSakuraKimono_v1",
        "report": "tools/reports/azure_sakura_dress_polishfit_verify_report.json"
      }
    },
    {
      "step_id": "preview_render",
      "stage": "export-ready",
      "step_type": "blender_script",
      "description": "Capture a front preview render for the cleaned clothing asset.",
      "outputs": {
        "preview_render_path": "tools/renders/azure_sakura_polishfit/current.png"
      },
      "notes": [],
      "script_path": "tools/blender_render_asset_front.py",
      "script_absolute_path": "D:\\antigaravity_code\\app_tro_ly\\tools\\blender_render_asset_front.py",
      "command_spec": {
        "runner": "blender_cli",
        "executable_hint": "blender",
        "argv": [
          "blender",
          "--background",
          "--python",
          "D:\\antigaravity_code\\app_tro_ly\\tools\\blender_render_asset_front.py",
          "--",
          "--input",
          "bleder/CHR_Dress_AzureSakura_v001_polishfit.blend",
          "--output",
          "tools/renders/azure_sakura_polishfit/current.png"
        ]
      },
      "args": {
        "input": "bleder/CHR_Dress_AzureSakura_v001_polishfit.blend",
        "output": "tools/renders/azure_sakura_polishfit/current.png"
      }
    }
  ],
  "validation_report_path": "tools/reports/azure_sakura_dress_polishfit_verify_report.json",
  "preview_render_path": "tools/renders/azure_sakura_polishfit/current.png",
  "checks": [
    {
      "id": "source_path_exists",
      "passed": true,
      "summary": "Source intake path exists.",
      "evidence_path": "Meshy_AI_Azure_Sakura_Kimono_0326010047_texture_fbx/Meshy_AI_Azure_Sakura_Kimono_0326010047_texture.fbx"
    },
    {
      "id": "workflow_spec_exists",
      "passed": true,
      "summary": "Workflow spec exists for the selected profile.",
      "evidence_path": "ai-dev-system/workflows/mesh-ai-refine-avatar-clothing.yaml"
    },
    {
      "id": "profile_exists",
      "passed": true,
      "summary": "Asset profile exists for the selected intake.",
      "evidence_path": "ai-dev-system/asset-pipeline/profiles/unity_avatar_clothing_v1.json"
    },
    {
      "id": "tool_script_exists::asset_audit",
      "passed": true,
      "summary": "Root Blender helper exists for step 'asset_audit'.",
      "evidence_path": "tools/blender_asset_audit.py"
    },
    {
      "id": "tool_script_exists::dress_fit",
      "passed": true,
      "summary": "Root Blender helper exists for step 'dress_fit'.",
      "evidence_path": "tools/blender_fit_dress_scene.py"
    },
    {
      "id": "tool_script_exists::scene_state_report",
      "passed": true,
      "summary": "Root Blender helper exists for step 'scene_state_report'.",
      "evidence_path": "tools/blender_scene_state_report.py"
    },
    {
      "id": "tool_script_exists::verify_fit",
      "passed": true,
      "summary": "Root Blender helper exists for step 'verify_fit'.",
      "evidence_path": "tools/blender_verify_dress_scene.py"
    },
    {
      "id": "tool_script_exists::preview_render",
      "passed": true,
      "summary": "Root Blender helper exists for step 'preview_render'.",
      "evidence_path": "tools/blender_render_asset_front.py"
    },
    {
      "id": "artifact_output_exists::asset_audit::report_path",
      "passed": true,
      "summary": "Executed artifact exists for 'asset_audit' output 'report_path'.",
      "evidence_path": "tools/reports/azure_kimono_asset_audit.json"
    },
    {
      "id": "artifact_output_exists::dress_fit::cleaned_source_path",
      "passed": true,
      "summary": "Executed artifact exists for 'dress_fit' output 'cleaned_source_path'.",
      "evidence_path": "bleder/CHR_Dress_AzureSakura_v001_polishfit.blend"
    },
    {
      "id": "artifact_output_exists::dress_fit::report_path",
      "passed": true,
      "summary": "Executed artifact exists for 'dress_fit' output 'report_path'.",